persona_name,persona_archetype,question_id,question_category,run_number,brand,canonical,sentiment,rank,attributes,quote
Priya,Macro-Tracking Fitness Enthusiast,Q4_04,discovery_trend,2,McDonald’s,McDonald's,positive,primary,"protein, variety, customization","Almost every major chain (Chick-fil-A, Chipotle, Wendy’s, Qdoba, McDonald’s, etc.) will let you add *extra* grilled chicken, steak, or eggs—usually for $2–$3."
Priya,Macro-Tracking Fitness Enthusiast,Q4_04,discovery_trend,2,In-N-Out,In-N-Out Burger,positive,mentioned,"customization, protein","Order sandwiches and burgers “protein-style”/lettuce-wrapped (In-N-Out, Carl’s Jr., Five Guys), or simply as “no bun” (McD, Wendy’s)."
Priya,Macro-Tracking Fitness Enthusiast,Q4_04,discovery_trend,2,Carl’s Jr.,Carl's Jr.,positive,mentioned,"customization, protein","Order sandwiches and burgers “protein-style”/lettuce-wrapped (In-N-Out, Carl’s Jr., Five Guys), or simply as “no bun” (McD, Wendy’s)."
Priya,Macro-Tracking Fitness Enthusiast,Q4_04,discovery_trend,2,Five Guys,Five Guys,positive,mentioned,"customization, protein","Order sandwiches and burgers “protein-style”/lettuce-wrapped (In-N-Out, Carl’s Jr., Five Guys), or simply as “no bun” (McD, Wendy’s)."
Priya,Macro-Tracking Fitness Enthusiast,Q4_04,discovery_trend,2,Starbucks,Starbucks,positive,primary,"protein, variety, customization","Add egg whites (Starbucks, McD breakfast, Panera), extra veggies (Chipotle, Subway, Sweetgreen, or CAVA), or a side salad/fruit cup."
Priya,Macro-Tracking Fitness Enthusiast,Q4_04,discovery_trend,2,Panera,Panera Bread,positive,mentioned,"protein, variety","Add egg whites (Starbucks, McD breakfast, Panera), extra veggies (Chipotle, Subway, Sweetgreen, or CAVA), or a side salad/fruit cup."
Priya,Macro-Tracking Fitness Enthusiast,Q4_04,discovery_trend,2,Subway,Subway,positive,mentioned,"variety, customization","extra veggies (Chipotle, Subway, Sweetgreen, or CAVA)"
Priya,Macro-Tracking Fitness Enthusiast,Q4_04,discovery_trend,2,Sweetgreen,Sweetgreen,positive,mentioned,"variety, customization","extra veggies (Chipotle, Subway, Sweetgreen, or CAVA)"
Priya,Macro-Tracking Fitness Enthusiast,Q4_04,discovery_trend,2,CAVA,CAVA,positive,mentioned,"variety, customization","extra veggies (Chipotle, Subway, Sweetgreen, or CAVA)"
Priya,Macro-Tracking Fitness Enthusiast,Q4_04,discovery_trend,2,Taco Bell,Taco Bell,positive,primary,"customization, protein","Taco Bell, Del Taco, or Chipotle? Order “fresco style” (Taco Bell, replaces cheese/sauces with pico), or get a bowl instead of a tortilla."
Priya,Macro-Tracking Fitness Enthusiast,Q4_04,discovery_trend,2,Del Taco,Del Taco,positive,mentioned,"customization, protein","Taco Bell, Del Taco, or Chipotle? Order “fresco style” (Taco Bell, replaces cheese/sauces with pico), or get a bowl instead of a tortilla."
Priya,Macro-Tracking Fitness Enthusiast,Q4_04,discovery_trend,2,Dunkin’,Dunkin',positive,mentioned,"protein, variety","At places like McDonald’s, Starbucks, Panera, or Dunkin’, you can usually order plain egg patties or “egg only” sandwiches."
Priya,Macro-Tracking Fitness Enthusiast,Q4_04,discovery_trend,3,In-N-Out,In-N-Out Burger,positive,secondary,"protein, customization","Go for lettuce wraps, especially at places like In-N-Out (""protein style"")"
Priya,Macro-Tracking Fitness Enthusiast,Q4_04,discovery_trend,3,Carl’s Jr.,Carl’s Jr.,positive,secondary,"protein, customization","Go for lettuce wraps, especially at places like In-N-Out (""protein style"") or Carl’s Jr."
Priya,Macro-Tracking Fitness Enthusiast,Q4_04,discovery_trend,3,Chipotle,Chipotle,positive,primary,"protein, customization, variety","Chipotle, Subway, Taco Bell's Power Bowls… it adds cost, but it *significantly* boosts your protein without extra processed carbs or fillers."
Priya,Macro-Tracking Fitness Enthusiast,Q4_04,discovery_trend,3,Subway,Subway,positive,primary,"protein, customization, variety","Chipotle, Subway, Taco Bell's Power Bowls… it adds cost, but it *significantly* boosts your protein without extra processed carbs or fillers."
Priya,Macro-Tracking Fitness Enthusiast,Q4_04,discovery_trend,3,Taco Bell,Taco Bell,positive,primary,"protein, customization, variety","Chipotle, Subway, Taco Bell's Power Bowls… it adds cost, but it *significantly* boosts your protein without extra processed carbs or fillers."
Priya,Macro-Tracking Fitness Enthusiast,Q4_04,discovery_trend,3,Chick-fil-A,Chick-fil-A,positive,primary,"protein, health, customization","Places like Chick-fil-A, Popeyes, McDonald’s, and Wendy’s all offer grilled options that slash both fat and calories and keep protein high."
Priya,Macro-Tracking Fitness Enthusiast,Q4_04,discovery_trend,3,Popeyes,Popeyes,positive,mentioned,"protein, health","Places like Chick-fil-A, Popeyes, McDonald’s, and Wendy’s all offer grilled options that slash both fat and calories and keep protein high."
Priya,Macro-Tracking Fitness Enthusiast,Q4_04,discovery_trend,3,McDonald’s,McDonald's,positive,primary,"protein, health, customization","Places like Chick-fil-A, Popeyes, McDonald’s, and Wendy’s all offer grilled options that slash both fat and calories and keep protein high."
Priya,Macro-Tracking Fitness Enthusiast,Q4_04,discovery_trend,3,Wendy’s,Wendy's,positive,mentioned,"protein, health","Places like Chick-fil-A, Popeyes, McDonald’s, and Wendy’s all offer grilled options that slash both fat and calories and keep protein high."
Priya,Macro-Tracking Fitness Enthusiast,Q4_04,discovery_trend,3,Dunkin’,Dunkin',positive,mentioned,"protein, customization","Most places will sell you side orders of egg and meat (I do this at Dunkin’, McDonald’s, and Starbucks)."
Priya,Macro-Tracking Fitness Enthusiast,Q4_04,discovery_trend,3,Starbucks,Starbucks,positive,primary,"protein, convenience","Most places will sell you side orders of egg and meat (I do this at Dunkin’, McDonald’s, and Starbucks)."
Priya,Macro-Tracking Fitness Enthusiast,Q4_04,discovery_trend,3,Five Guys,Five Guys,positive,mentioned,"protein, customization","Many chains have high-protein “off-menu” options (In-N-Out, Five Guys, etc.)."
Priya,Macro-Tracking Fitness Enthusiast,Q4_05,discovery_trend,1,Wendy’s,Wendy's,positive,primary,"protein, portability, taste, convenience","Wendy’s put out a Grilled Chicken Ranch Wrap competing with McDonald’s discontinued snack wraps. Nutritionally, it’s better than most: ~420 calories, 21g protein. I skip the ranch to drop fat and add a packet of their hot honey sauce (surprisingly good, low cal). Not earth-shattering, but a solid on-the-go high-protein snack—beats most burger options for macro balance."
Priya,Macro-Tracking Fitness Enthusiast,Q4_05,discovery_trend,1,McDonald’s,McDonald's,neutral,mentioned,,Wendy’s put out a Grilled Chicken Ranch Wrap competing with McDonald’s discontinued snack wraps.
Priya,Macro-Tracking Fitness Enthusiast,Q4_05,discovery_trend,1,Chipotle,Chipotle,positive,primary,"protein, quality, taste, variety","Chipotle brought back Al Pastor with a bang—good flavor, and the protein is lean. If you skip cheese and sour cream, double the Al Pastor, and go light on rice, you’re looking at ~40-50g protein and still under 650 calories."
Priya,Macro-Tracking Fitness Enthusiast,Q4_05,discovery_trend,1,Starbucks,Starbucks,positive,secondary,"protein, portability, convenience","Starbucks Protein Box with Smoked Turkey (2024): Not huge, but pairs well with a protein coffee if you’re in a pinch—24g protein, decent carbs, around 360 cals. Not as customizable as I’d like, but for grab-and-go, it’s solid."
Priya,Macro-Tracking Fitness Enthusiast,Q4_05,discovery_trend,2,Chick-fil-A,Chick-fil-A,positive,primary,"protein, taste, variety, app","Chick-fil-A: Maple Pepper Bacon Sandwich - Why it's good: It’s CHICKEN (grilled or fried, your call), decent protein, and it comes standard with bacon for a bump in protein/fat."
Priya,Macro-Tracking Fitness Enthusiast,Q4_05,discovery_trend,2,Chipotle,Chipotle,positive,primary,"protein, taste, variety","Chipotle: Chicken Al Pastor - Why it's good: New protein option, strong flavor, about 32g protein/serving. It’s a nice spin on their standard chicken and not drastically higher in calories."
Priya,Macro-Tracking Fitness Enthusiast,Q4_05,discovery_trend,2,Panera,Panera Bread,positive,primary,"protein, variety, health, quality","Panera: Toasted Baguette Sandwiches (Pick the Green Goddess Caprese) - Why it's good: If you add grilled chicken (they let you!), you get a solid protein veggie-forward sandwich, and Panera actually has nutrition transparency."
Priya,Macro-Tracking Fitness Enthusiast,Q4_05,discovery_trend,2,Wendy’s,Wendy's,positive,primary,"protein, portability, taste, convenience","Wendy’s: Grilled Chicken Ranch Wrap - Why it's good: It’s compact, actually has juicy grilled chicken and ranch for flavor, and the calories/macros are reasonable for something ""fast food."""
Priya,Macro-Tracking Fitness Enthusiast,Q4_05,discovery_trend,2,Starbucks,Starbucks,neutral,mentioned,protein,"Starbucks added a new Chicken, Maple Butter & Egg Sandwich—not the best macros (450 cal, 18g protein), but it’s light enough to pair with a protein box or plain eggs for more staying power."
Priya,Macro-Tracking Fitness Enthusiast,Q4_05,discovery_trend,3,Wendy’s,Wendy's,positive,primary,"protein, health, customizable, taste","One recent release that actually stands out from a macro-friendly, high-protein perspective is the **Wendy’s Grilled Chicken Ranch Wrap**."
Priya,Macro-Tracking Fitness Enthusiast,Q4_05,discovery_trend,3,Chipotle,Chipotle,positive,secondary,"protein, health, taste, variety, customizable","Runner-up: **Chipotle Chicken Al Pastor**—technically not brand new, but their recent protein rotation is INSANELY flavorful and the macros are excellent (~170 cal, 30g protein/serving)."
Priya,Macro-Tracking Fitness Enthusiast,Q4_05,discovery_trend,3,Taco Bell,Taco Bell,neutral,mentioned,,"Many other “new” items this year (Taco Bell’s Cantina menu returns, Popeyes’ Blackened Deluxe Chicken Sandwich) are just slight tweaks, but those two above are actually bona fide high-protein fast food options, not just marketing."
Priya,Macro-Tracking Fitness Enthusiast,Q4_05,discovery_trend,3,Popeyes,Popeyes,neutral,mentioned,,"Many other “new” items this year (Taco Bell’s Cantina menu returns, Popeyes’ Blackened Deluxe Chicken Sandwich) are just slight tweaks, but those two above are actually bona fide high-protein fast food options, not just marketing."
Priya,Macro-Tracking Fitness Enthusiast,Q5_01,strategic_planning,1,Chipotle,Chipotle,positive,primary,"customization, protein, variety, health, convenience","Build-your-own bowls—super customizable, high protein (chicken, steak, sofritas, etc.), paleo/vegan/keto options, and nutrition calculator is accurate."
Priya,Macro-Tracking Fitness Enthusiast,Q5_01,strategic_planning,1,Sweetgreen,Sweetgreen,positive,secondary,"variety, protein, health, quality","Best for salad/grain bowls—tons of plant-based and protein add-ons (chicken, tofu, shrimp, hard boiled eggs), and nutrition info is clear."
Priya,Macro-Tracking Fitness Enthusiast,Q5_01,strategic_planning,1,CAVA,CAVA,positive,secondary,"protein, customization, variety, health","Mediterranean bowls—grilled proteins (chicken, lamb, falafel), easy to go low-carb or heavy on protein, vegan choices."
Priya,Macro-Tracking Fitness Enthusiast,Q5_01,strategic_planning,1,Panera,Panera Bread,positive,secondary,"variety, protein, health, customization","Sandwiches, salads, bowls—better protein and veggie balance than most traditional sandwich chains. Vegan/veg and gluten-free options marked."
Priya,Macro-Tracking Fitness Enthusiast,Q5_01,strategic_planning,1,MOD Pizza,MOD Pizza,positive,secondary,"customization, variety, protein","Individual pizzas, but gluten-free crusts and tons of veggie/protein toppings; both have vegan cheese/meat options."
Priya,Macro-Tracking Fitness Enthusiast,Q5_01,strategic_planning,1,Blaze Pizza,Blaze Pizza,positive,secondary,"customization, variety, protein","Individual pizzas, but gluten-free crusts and tons of veggie/protein toppings; both have vegan cheese/meat options."
Priya,Macro-Tracking Fitness Enthusiast,Q5_01,strategic_planning,2,Chipotle,Chipotle,positive,primary,"variety, protein, health, convenience","Completely customizable bowls. Tons of plant and animal protein options, easy to make bowls low- or high-carb, dairy-free, etc."
Priya,Macro-Tracking Fitness Enthusiast,Q5_01,strategic_planning,2,Cava,Cava,positive,secondary,"variety, protein, health, taste","Mediterranean bowls with tons of veggies, protein, and great vegan/lactose-free/gluten-free options."
Priya,Macro-Tracking Fitness Enthusiast,Q5_01,strategic_planning,2,Sweetgreen,Sweetgreen,positive,secondary,"variety, protein, health, quality","Custom salads and grain bowls, plenty of vegan/vegetarian/protein choices."
Priya,Macro-Tracking Fitness Enthusiast,Q5_01,strategic_planning,2,Panera Bread,Panera Bread,positive,secondary,"variety, family-friendly","Sandwiches, grain bowls, hearty salads, soups. Both veggie and meat options."
Priya,Macro-Tracking Fitness Enthusiast,Q5_01,strategic_planning,2,Naf Naf Grill,Naf Naf Grill,positive,secondary,"variety, protein, taste","Middle Eastern bowls/platters, easy to customize, lots of flavor, and great for both meat lovers and vegetarians."
Priya,Macro-Tracking Fitness Enthusiast,Q5_01,strategic_planning,3,Cava,Cava,positive,primary,"variety, protein, health, convenience, taste","Cava: Customizable bowls—pita, rice, greens, or grains; tons of proteins (chicken, lamb, falafel, roasted veggies); vegan, vegetarian, gluten-free handled easily; easy to hit macro targets (I get double chicken and hummus for bulk protein, skip dressings if you want to cut cals)."
Priya,Macro-Tracking Fitness Enthusiast,Q5_01,strategic_planning,3,Chipotle,Chipotle,positive,primary,"variety, protein, value, convenience, taste","Chipotle: Familiar, customizable; tons of protein if you double meat, lots of veg/vegan options; not expensive."
Priya,Macro-Tracking Fitness Enthusiast,Q5_01,strategic_planning,3,Sweetgreen,Sweetgreen,positive,secondary,"health, variety, protein, quality","Sweetgreen: Healthy, fresh, vegetarian/vegan friendly, protein add-ons (chicken, fish, tofu); transparent nutrition facts."
Priya,Macro-Tracking Fitness Enthusiast,Q5_01,strategic_planning,3,MOD Pizza,MOD Pizza,positive,secondary,"variety, protein, convenience","MOD Pizza / Blaze Pizza: Custom pies, gluten-free and vegan cheeses/crusts, protein add-ons."
Priya,Macro-Tracking Fitness Enthusiast,Q5_01,strategic_planning,3,Blaze Pizza,Blaze Pizza,positive,secondary,"variety, protein, convenience","MOD Pizza / Blaze Pizza: Custom pies, gluten-free and vegan cheeses/crusts, protein add-ons."
Priya,Macro-Tracking Fitness Enthusiast,Q5_01,strategic_planning,3,Panera,Panera Bread,positive,secondary,"variety, health, customization","Panera: Salads, sandwiches, bowls; lots of veggie/vegan and allergen info; you can customize."
Priya,Macro-Tracking Fitness Enthusiast,Q5_01,strategic_planning,3,McDonald’s,McDonald's,negative,mentioned,variety,"Chains I'd avoid for this: McDonald’s, Wendy’s, or Burger King—too hard to please vegans/vegetarians, not enough macro-friendly diversity."
Priya,Macro-Tracking Fitness Enthusiast,Q5_01,strategic_planning,3,Wendy’s,Wendy's,negative,mentioned,variety,"Chains I'd avoid for this: McDonald’s, Wendy’s, or Burger King—too hard to please vegans/vegetarians, not enough macro-friendly diversity."
Priya,Macro-Tracking Fitness Enthusiast,Q5_01,strategic_planning,3,Burger King,Burger King,negative,mentioned,variety,"Chains I'd avoid for this: McDonald’s, Wendy’s, or Burger King—too hard to please vegans/vegetarians, not enough macro-friendly diversity."
Priya,Macro-Tracking Fitness Enthusiast,Q5_02,strategic_planning,1,Chipotle,Chipotle,positive,primary,"protein, customization, variety","Chipotle - Order: Burrito Bowl with double chicken, white rice, black beans, fajita veggies, tomato salsa, and a little bit of cheese."
Priya,Macro-Tracking Fitness Enthusiast,Q5_02,strategic_planning,1,Chick-fil-A,Chick-fil-A,positive,primary,"protein, taste, health",Chick-fil-A - Order: Grilled Chicken Sandwich (no sauce) + 12-count Grilled Nuggets
Priya,Macro-Tracking Fitness Enthusiast,Q5_02,strategic_planning,1,Wendy’s,Wendy's,positive,primary,"protein, variety, value",Wendy’s - Order: Grilled Chicken Wrap + Small Chili
Priya,Macro-Tracking Fitness Enthusiast,Q5_02,strategic_planning,1,Subway,Subway,positive,primary,"protein, variety, customization","Subway - Order: 6-inch Turkey, Egg White, and Cheese on wheat, double the meat, lots of veggies"
Priya,Macro-Tracking Fitness Enthusiast,Q5_02,strategic_planning,1,Panda Express,Panda Express,positive,primary,"protein, health, variety","Panda Express - Order: ""Bowl"" with Super Greens instead of rice, Double Grilled Teriyaki Chicken (no sauce or sauce on the side)"
Priya,Macro-Tracking Fitness Enthusiast,Q5_02,strategic_planning,2,Chipotle,Chipotle,positive,primary,"protein, variety, customization","Chipotle (or similar burrito bowl spot)
- What I order: Double chicken or steak bowl (sometimes half and half), brown rice (light scoop or skip if I had a ton of carbs during the day), fajita veggies, tomato salsa, lettuce."
Priya,Macro-Tracking Fitness Enthusiast,Q5_02,strategic_planning,2,Chick-fil-A,Chick-fil-A,positive,primary,"protein, health, customization","Chick-fil-A
- What I order: Grilled chicken sandwich (no butter on the bun), add a side of grilled nuggets (8ct)."
Priya,Macro-Tracking Fitness Enthusiast,Q5_02,strategic_planning,2,Subway,Subway,positive,primary,"protein, variety, customization","Subway
- What I order: 6"" Turkey breast & Black Forest ham, double meat, all veggies, no cheese, mustard or vinaigrette."
Priya,Macro-Tracking Fitness Enthusiast,Q5_02,strategic_planning,2,Panda Express,Panda Express,positive,primary,"protein, customization","Panda Express
- What I order: Super Greens entrée (sub for rice), Double Grilled Teriyaki Chicken."
Priya,Macro-Tracking Fitness Enthusiast,Q5_02,strategic_planning,2,Taco Bell,Taco Bell,positive,primary,"protein, customization","Taco Bell
- What I order: Power Menu Bowl, chicken, no sour cream, light cheese, extra black beans, guac optional."
Priya,Macro-Tracking Fitness Enthusiast,Q5_02,strategic_planning,2,McDonald's,McDonald's,positive,secondary,"protein, customization","At almost any burger spot (McDonald's, Wendy’s, etc.) I do grilled chicken sandwiches (no mayo), ask for double patty if they do grilled, side salad or apple slices."
Priya,Macro-Tracking Fitness Enthusiast,Q5_02,strategic_planning,2,Wendy’s,Wendy's,positive,secondary,"protein, customization","At almost any burger spot (McDonald's, Wendy’s, etc.) I do grilled chicken sandwiches (no mayo), ask for double patty if they do grilled, side salad or apple slices."
Priya,Macro-Tracking Fitness Enthusiast,Q5_02,strategic_planning,3,Chipotle,Chipotle,positive,primary,"protein, value, customization","Chipotle
- My Go-to Order: Bowl with double chicken, white rice (or half rice), black beans, fajita veggies, tomato salsa, and lettuce. Skip the cheese/sour cream to save calories if needed. Their chicken is high in protein and relatively lean."
Priya,Macro-Tracking Fitness Enthusiast,Q5_02,strategic_planning,3,Chick-fil-A,Chick-fil-A,positive,primary,"protein, health, customization","Chick-fil-A
- Order: Grilled Chicken Sandwich (add extra grilled filet if possible), and a side of Fruit Cup or Superfood Side. Or go for a 12-count Grilled Nuggets with side salad (no dressing or light dressing)."
Priya,Macro-Tracking Fitness Enthusiast,Q5_02,strategic_planning,3,Wendy’s,Wendy's,positive,primary,"protein, value, customization","Wendy’s
- Order: Grilled Chicken Sandwich and a small chili. Skip mayo for lower fat. Chili is surprisingly high protein for the calories."
Priya,Macro-Tracking Fitness Enthusiast,Q5_02,strategic_planning,3,Subway,Subway,positive,primary,"protein, customization, health","Subway
- Order: 6” or footlong Turkey or Rotisserie Chicken sub on whole wheat, pile on veggies, mustard/vinegar for sauce, add double meat for protein bang."
Priya,Macro-Tracking Fitness Enthusiast,Q5_02,strategic_planning,3,Starbucks,Starbucks,positive,primary,"protein, convenience","Starbucks
- Order: 2x Egg White & Roasted Red Pepper Sous Vide Egg Bites and Protein Box (or just double up on egg bites)"
Priya,Macro-Tracking Fitness Enthusiast,Q5_03,strategic_planning,1,El Pollo Loco,El Pollo Loco,positive,primary,"protein, quality, health, variety, taste, consistency","Chain Recommendation: El Pollo Loco

They often get overshadowed by the bigger Mexican fast food names, but they’re killer if protein is your priority. Everything’s grilled and the nutrition info is straightforward."
Priya,Macro-Tracking Fitness Enthusiast,Q5_03,strategic_planning,1,MOD Pizza,MOD Pizza,positive,secondary,"protein, variety, customization","MOD Pizza: Go for a protein-stacked salad bowl with grilled chicken, roasted red peppers, and pickled red onions—skip cheese and croutons for macros."
Priya,Macro-Tracking Fitness Enthusiast,Q5_03,strategic_planning,1,Shake Shack,Shake Shack,positive,secondary,"protein, variety","Shake Shack: Grilled chicken bites (not available everywhere), side salad, and a split protein-style burger if you’re craving variety without all the carbs."
Priya,Macro-Tracking Fitness Enthusiast,Q5_03,strategic_planning,2,El Pollo Loco,El Pollo Loco,positive,primary,"protein, customizable, quality, taste, health, variety, value","I’d recommend trying **El Pollo Loco** if you haven’t already. They *fly* under the radar for high-protein and customizable fast food, especially if you’re prioritizing both performance fueling (hello, CrossFit recovery) and reasonably “clean” macros."
Priya,Macro-Tracking Fitness Enthusiast,Q5_03,strategic_planning,2,CAVA,CAVA,positive,secondary,"protein, customizable, variety, health","**CAVA (if you have one):** Build a “greens & grains” bowl, double grilled chicken, all the chopped veggies, skip or go light on spreads/dressing. ~40–60g protein easily."
Priya,Macro-Tracking Fitness Enthusiast,Q5_03,strategic_planning,2,Chipotle,Chipotle,positive,secondary,"protein, customizable, variety, health","**Chipotle:** Salad bowl, double chicken or steak, fajita veggies, all the salsa, no rice/beans if you want to spare carbs. Skip cheese/sour cream. Easily hits 50g protein."
Priya,Macro-Tracking Fitness Enthusiast,Q5_03,strategic_planning,2,Jersey Mike’s,Jersey Mike’s,positive,secondary,"protein, customizable, variety","**Jersey Mike’s:** Giant #7 or #3 sub “in a tub,” add extra meat, skip cheese and mayo for lower fat, load up veggies. Protein bomb, not too high in calories."
Priya,Macro-Tracking Fitness Enthusiast,Q5_03,strategic_planning,3,CAVA,CAVA,positive,primary,"protein, variety, health, customization, quality","CAVA—Mediterranean build-your-own bowls = easy to load up on protein & veggies, and you control everything. Nutrition info is transparent and customization is top-notch."
Priya,Macro-Tracking Fitness Enthusiast,Q5_03,strategic_planning,3,El Pollo Loco,El Pollo Loco,positive,primary,"protein, quality, health, variety","El Pollo Loco—Underrated for quality lean protein (fire-grilled chicken), lots of salsa/veggie sides, and good macros if you skip tortillas/rice."
Priya,Macro-Tracking Fitness Enthusiast,Q5_03,strategic_planning,3,Sweetgreen,Sweetgreen,positive,primary,"quality, protein, variety, health","Sweetgreen—Higher-end (pricier) build-a-bowl chain—excellent for huge salads loaded with grilled chicken, roasted tofu, even blackened fish in some locations."
Priya,Macro-Tracking Fitness Enthusiast,Q5_03,strategic_planning,3,Jersey Mike’s,Jersey Mike's,positive,primary,"protein, variety, customization",Jersey Mike’s—Surprising macro wins with the Sub in a Tub option—ditch the roll to turn any sub into a salad bowl. They’ll pile on protein if you ask.
Priya,Macro-Tracking Fitness Enthusiast,Q5_03,strategic_planning,3,Chipotle,Chipotle,positive,primary,"protein, customization, app, health","Chipotle (if you haven’t been, or if you get the same burrito every time)—Order via the app for easy macro tracking."
Priya,Macro-Tracking Fitness Enthusiast,Q5_04,strategic_planning,1,Chipotle,Chipotle,positive,primary,"protein, customization, transparency, health","I tend to recommend **Chipotle** or **Sweetgreen** (if those count as ""fast casual"")"
Priya,Macro-Tracking Fitness Enthusiast,Q5_04,strategic_planning,1,Sweetgreen,Sweetgreen,positive,primary,"quality, customization, health","I tend to recommend **Chipotle** or **Sweetgreen** (if those count as ""fast casual"")"
Priya,Macro-Tracking Fitness Enthusiast,Q5_04,strategic_planning,1,Chick-fil-A,Chick-fil-A,positive,primary,"protein, customization, health","for traditional fast food, **Chick-fil-A** and **Subway** are pretty easy to work with"
Priya,Macro-Tracking Fitness Enthusiast,Q5_04,strategic_planning,1,Subway,Subway,positive,primary,"protein, customization, health","for traditional fast food, **Chick-fil-A** and **Subway** are pretty easy to work with"
Priya,Macro-Tracking Fitness Enthusiast,Q5_04,strategic_planning,1,Panera,Panera Bread,positive,secondary,"protein, health",**Panera:** Protein bowls & half-salads with grilled chicken or steak.
Priya,Macro-Tracking Fitness Enthusiast,Q5_04,strategic_planning,1,Starbucks,Starbucks,positive,secondary,"protein, portability, health","**Starbucks:** Protein boxes (egg & cheese, chicken & hummus, etc.), not huge, but decent for snacks."
