persona_name,persona_archetype,question_id,question_category,run_number,brand,canonical,sentiment,rank,attributes,quote
Jenna,Nutrition-Conscious Parent,Q2_05,need_constraint,3,Wendy’s,Wendy's,positive,primary,"value, deals, variety, family-friendly","Biggie Bag Deal—for $5 each, you get a sandwich, nuggets, fries, and a drink. Mix and match five of these for around $25. Sometimes they offer a specific Family Meal Deal with 50 nuggets and fries for under $20, but check your local store/app for deals first."
Jenna,Nutrition-Conscious Parent,Q2_05,need_constraint,3,Burger King,Burger King,positive,primary,"value, deals, family-friendly, app","Family Bundle Deals pop up in the app—commonly $22–$25 for three Whoppers, three cheeseburgers, and three small fries. Not quite enough for five, but you can add a couple jr. sandwiches or sides and stay right around $30."
Jenna,Nutrition-Conscious Parent,Q2_05,need_constraint,3,KFC,KFC,positive,primary,"value, family-friendly, variety, quality",8-piece Chicken & 2 Large Sides—usually around $28–$32. Add extra biscuits or swap for the 12-piece meal if your family are bigger eaters. The sides are usually generous.
Jenna,Nutrition-Conscious Parent,Q2_05,need_constraint,3,Taco Bell,Taco Bell,positive,primary,"value, variety, family-friendly, deals, taste","Build Your Own Cravings Box—$5–$8 per person (customizable mains, sides, and drink). A Taco Party Pack (12 tacos for ~$18) plus a side or two is usually enough for the family, and very kid-friendly if your kids eat tacos."
Jenna,Nutrition-Conscious Parent,Q2_05,need_constraint,3,Domino’s,Domino's,positive,primary,"value, deals, family-friendly, variety",Large 3-Topping pizzas are $7–$10 each when you order multiple. 2–3 pizzas plus breadsticks or a salad will feed five easily for $25–$30.
Jenna,Nutrition-Conscious Parent,Q2_05,need_constraint,3,Pizza Hut,Pizza Hut,positive,primary,"value, deals, family-friendly, variety",Large 3-Topping pizzas are $7–$10 each when you order multiple. 2–3 pizzas plus breadsticks or a salad will feed five easily for $25–$30.
Jenna,Nutrition-Conscious Parent,Q3_01,comparative_evaluative,1,Chick-fil-A,Chick-fil-A,positive,primary,"quality, taste, family-friendly, consistency, value, deals, variety, health","my personal front-runner is Chick-fil-A’s Original Chicken Sandwich. It’s had staying power for a reason: the chicken is always juicy, not too greasy, and the pickles + buttery bun kind of do it for me. Bonus: simple flavors, so my kids don’t fuss."
Jenna,Nutrition-Conscious Parent,Q3_01,comparative_evaluative,1,Popeyes,Popeyes,positive,secondary,"taste, quality, value","Popeyes Classic Chicken Sandwich: If you want that super crispy, “how is this still juicy inside?” crunch, this one’s the gold standard lately. The breading is peppery and has flavor, but sometimes the sandwiches can be *huge*—which is good for value but a little aggressive for a 6-year-old."
Jenna,Nutrition-Conscious Parent,Q3_01,comparative_evaluative,1,Wendy’s,Wendy's,positive,secondary,"consistency, variety, value, deals, family-friendly, health",Wendy’s Classic Chicken Sandwich: Solid option. Not quite as exciting but very consistent and the lettuce/tomato/ mayo is a plus for a little freshness.
Jenna,Nutrition-Conscious Parent,Q3_01,comparative_evaluative,1,KFC,KFC,positive,secondary,"quality, taste","KFC Chicken Sandwich: Honestly, pretty solid. Big filets, lots of crunch, and a little more peppery than Chick-fil-A. Some people say it's even better than Popeyes, but I think it depends on the location."
Jenna,Nutrition-Conscious Parent,Q3_01,comparative_evaluative,2,Chick-fil-A,Chick-fil-A,positive,primary,"quality, consistency, family-friendly, health, variety",Chick-fil-A is the one my kids most reliably eat (and it feels least processed of the big ones).
Jenna,Nutrition-Conscious Parent,Q3_01,comparative_evaluative,2,Popeyes,Popeyes,positive,secondary,"taste, quality, protein",Popeyes is my top “treat” pick for flavor—just maybe split it for smaller kids or get the tenders instead.
Jenna,Nutrition-Conscious Parent,Q3_01,comparative_evaluative,2,Wendy’s,Wendy's,positive,secondary,"consistency, variety, health, quality","Wendy’s is the most balanced for everyone, and the grilled version is a safe bet for parents watching fat/salt."
Jenna,Nutrition-Conscious Parent,Q3_01,comparative_evaluative,2,KFC,KFC,neutral,mentioned,taste,"KFC Classic Chicken Sandwich: Similar to Popeyes, big and crispy, but honestly can be hit-or-miss. Sometimes ours is just too greasy."
Jenna,Nutrition-Conscious Parent,Q3_01,comparative_evaluative,3,Chick-fil-A,Chick-fil-A,positive,primary,"taste, quality, value, family-friendly, transparency, variety","The chicken is always juicy, freshly breaded, and tastes like actual chicken (not spongy or overly processed). They’re transparent about their cooking oil and keep ingredients relatively simple."
Jenna,Nutrition-Conscious Parent,Q3_01,comparative_evaluative,3,Popeyes,Popeyes,positive,secondary,"taste, variety, family-friendly, deals","Massively flavorful—crispy, well-seasoned, extra juicy. It feels a little ""heavier"" to me, but it’s a real crowd-pleaser."
Jenna,Nutrition-Conscious Parent,Q3_01,comparative_evaluative,3,Wendy’s,Wendy's,positive,secondary,"quality, value, taste, variety","Fresh, never frozen chicken and a nice crunchy coating. Fewer weird additives than some others."
Jenna,Nutrition-Conscious Parent,Q3_01,comparative_evaluative,3,KFC,KFC,positive,secondary,"taste, family-friendly","Actually tasty, but more “fast food fried chicken” vibe. My kids love theirs plain."
Jenna,Nutrition-Conscious Parent,Q3_02,comparative_evaluative,1,Chick-fil-A,Chick-fil-A,positive,primary,"taste, family-friendly, health, speed","Chick-fil-A is pretty good for breakfast—their chicken minis are always a hit with my kids, and honestly, their yogurt parfait is one of the better fast food options if you want something lighter. They usually move pretty quickly in the mornings, too."
Jenna,Nutrition-Conscious Parent,Q3_02,comparative_evaluative,1,McDonald's,McDonald's,positive,secondary,"convenience, value, family-friendly, portability, variety","McDonald's is classic and hard to beat for convenience. My youngest loves their hotcakes, and the Egg McMuffin isn’t too bad for a grab-and-go that isn’t greasy. I like that you can mix and match from the value menu, so you can usually feed everyone for around $30."
Jenna,Nutrition-Conscious Parent,Q3_02,comparative_evaluative,1,Panera,Panera Bread,positive,secondary,"quality, variety, health","If you want something that feels a bit more homemade, Panera can be really nice—they have soufflés, breakfast sandwiches, and some fruit options. It’s pricier than, say, McDonald’s or Burger King, and not always as quick if you’re rushed, but it scratches the “better ingredients” itch."
Jenna,Nutrition-Conscious Parent,Q3_02,comparative_evaluative,1,Burger King,Burger King,neutral,mentioned,,"It’s pricier than, say, McDonald’s or Burger King, and not always as quick if you’re rushed, but it scratches the “better ingredients” itch."
Jenna,Nutrition-Conscious Parent,Q3_02,comparative_evaluative,1,Wendy’s,Wendy's,positive,secondary,"taste, family-friendly, value, deals","I’ve also been surprised by Wendy’s breakfast lately. Their croissant sandwiches are pretty decent, and the seasoned potatoes are a huge hit for all my kids. The price point is similar to McDonald’s, and they do family meal deals sometimes."
Jenna,Nutrition-Conscious Parent,Q3_02,comparative_evaluative,2,Chick-fil-A,Chick-fil-A,positive,primary,"family-friendly, quality, consistency, convenience, service, variety, health","Honestly, for us, Chick-fil-A is a frequent go-to—especially if it’s not a Sunday. Their chicken minis are a hit with all three kids, and I like that you can swap fruit cups or get Greek yogurt parfaits as sides. I also appreciate that their ingredients lists are easy to find online, and I feel like the quality is generally reliable. Plus, the drive-thru is efficient."
Jenna,Nutrition-Conscious Parent,Q3_02,comparative_evaluative,2,Panera,Panera Bread,positive,secondary,"quality, health, family-friendly, variety","Panera is decent if we want something a bit more “real food” feeling—my kids like their bagels, and I can grab a breakfast sandwich with real eggs and avocado. The egg soufflés are also kid-approved in my house."
Jenna,Nutrition-Conscious Parent,Q3_02,comparative_evaluative,2,McDonald’s,McDonald's,positive,secondary,"value, protein, family-friendly, deals","If I really need to keep to a lower price point, McDonald’s is still hard to beat. Their Egg McMuffin has a short ingredient list and some protein, and the kids are always happy with hotcakes or hash browns. They also have those $3–$5 bundle deals sometimes."
Jenna,Nutrition-Conscious Parent,Q3_02,comparative_evaluative,2,McD’s,McDonald's,positive,mentioned,value,McD’s if budget wins out
Jenna,Nutrition-Conscious Parent,Q3_02,comparative_evaluative,3,Chick-fil-A,Chick-fil-A,positive,primary,"speed, taste, family-friendly, quality, convenience, service, variety, protein","Big hit for everyone. The chicken minis are soft and friendly for picky eaters. Their Greek yogurt parfait is actually really decent, and I like that they use fruit and granola. Bonus points for great coffee and super fast drive-thru."
Jenna,Nutrition-Conscious Parent,Q3_02,comparative_evaluative,3,McDonald’s,McDonald's,positive,secondary,"speed, value, deals, convenience, family-friendly, variety, portability","It’s everywhere and super fast, and their egg-based sandwiches like the Egg McMuffin aren’t the worst in terms of simple ingredients. They usually have decent deals (like the 2-for-$4 sandwich thing), and my kids *always* eat the hash browns."
Jenna,Nutrition-Conscious Parent,Q3_02,comparative_evaluative,3,Panera Bread,Panera Bread,positive,secondary,"quality, variety, health, family-friendly, convenience","Not exactly typical “fast food” but very doable for to-go breakfasts. They do breakfast sandwiches on real bread, and you can get fruit cups or yogurt for the kids. I like their coffee and appreciate that they post nutrition info so clearly."
Jenna,Nutrition-Conscious Parent,Q3_02,comparative_evaluative,3,Dunkin’,Dunkin',positive,secondary,"variety, taste, family-friendly, convenience","We will swing through sometimes if someone wants a treat. Egg wraps, bagel sandwiches, and hash browns are all crowd-pleasers. They aren’t the healthiest, but they’re filling, and you can get milk or juice for kids."
Jenna,Nutrition-Conscious Parent,Q3_03,comparative_evaluative,1,Chick-fil-A,Chick-fil-A,positive,primary,"family-friendly, health, service, variety, quality","I’d go with Chick-fil-A. Their kids’ meals are a hit with my crew (the grilled nuggets are a lifesaver for my picky eater), and I appreciate that they offer fruit cups, side salads, and milk as options instead of just fries and soda. I also like that their ingredient lists are usually pretty easy to find, and their food seems less greasy overall. Plus, I think the service is a notch above most places, which is great when wrangling three impatient, hungry kids in the car!"
Jenna,Nutrition-Conscious Parent,Q3_03,comparative_evaluative,2,Chick-fil-A,Chick-fil-A,positive,primary,"quality, health, family-friendly, convenience, consistency","I’d probably go with Chick-fil-A. I know it’s not the most adventurous choice, but their grilled nuggets, salads, and fruit cups feel a little fresher and less greasy than a lot of other places. My kids will actually eat their chicken strips or nuggets without a lot of fuss (and let’s be real, happy kids make these meals way less stressful). Plus, I appreciate that I can check out nutrition info and ingredients easily online. Their meals are just a bit more reliable when I’m trying to balance convenience with a tiny bit of nutrition and not feeling completely guilty after!"
Jenna,Nutrition-Conscious Parent,Q3_03,comparative_evaluative,3,Chick-fil-A,Chick-fil-A,positive,primary,"variety, family-friendly, health, app, convenience, service, speed, quality","I’d probably go with Chick-fil-A. The menu has a fair variety so there are options my kids will eat (nuggets and fries are a safe bet!), and I like that they offer things like grilled chicken and fruit cups for when I want to feel a little less guilty about fast food nights. Plus, their app makes it super easy to order ahead, and the drive-thru is usually quick and friendly—which is huge when I have three tired, hungry kids in the car. I also appreciate that their nutrition info is easy to find, and the ingredients list isn’t as crazy as some places."
Jenna,Nutrition-Conscious Parent,Q3_03,comparative_evaluative,3,Taco Bell,Taco Bell,positive,secondary,,I would miss the occasional Taco Bell order!
Jenna,Nutrition-Conscious Parent,Q3_04,comparative_evaluative,1,Chick-fil-A,Chick-fil-A,positive,primary,"consistency, service, quality, variety, family-friendly, health","In my experience, though, Chick-fil-A gets the closest to consistently good meals. Their staff is pretty friendly and the food is usually fresh, whether it’s grilled nuggets for my “chicken only!” kid or the classic sandwich. I don’t feel quite as guilty about their kids meals, since you can get fruit or a simple side."
Jenna,Nutrition-Conscious Parent,Q3_04,comparative_evaluative,1,Culver’s,Culver's,positive,secondary,"consistency, quality, variety, family-friendly, taste","Culver’s is also super reliable if you have one nearby—really fresh burgers, never had a soggy batch of fries, and their kids meals have good options (plus, you get custard!)."
Jenna,Nutrition-Conscious Parent,Q3_04,comparative_evaluative,1,Panera,Panera Bread,positive,secondary,"quality, variety, health, family-friendly","Panera is solid too, especially for sandwiches and soup, and I like being able to see all the nutritional info up front."
Jenna,Nutrition-Conscious Parent,Q3_04,comparative_evaluative,2,Chick-fil-A,Chick-fil-A,positive,primary,"consistency, quality, service, speed, family-friendly","Chick-fil-A is probably the one I trust the most for consistently good food (and friendly service). Even if it’s not our absolute favorite menu all the time, I can count on the nuggets, sammies, and sides being fresh—and super fast—for the kids. Plus, they seem to handle orders more carefully (they never forget sauces, which matters a lot in this house, lol)."
Jenna,Nutrition-Conscious Parent,Q3_04,comparative_evaluative,2,Culver’s,Culver's,positive,secondary,"quality, consistency, family-friendly","Culver’s is another one. Their burgers, chicken tenders, and even the sides always seem freshly made, and the quality is just better than most. Even the pickier kids will eat there without complaints. It’s a little pricier, but definitely “what you see is what you get.”"
Jenna,Nutrition-Conscious Parent,Q3_04,comparative_evaluative,2,Panera,Panera Bread,positive,secondary,"health, consistency","Panera is good, especially if you’re looking for slightly healthier options, but I will say sometimes portions are hit or miss. Still, I almost never get truly “bad” food from them."
Jenna,Nutrition-Conscious Parent,Q3_04,comparative_evaluative,2,McDonald’s,McDonald's,neutral,mentioned,"consistency, value","even though they can be all over the map, McDonald’s is SO standardized that you almost always get exactly what you expect. It’s not always amazing, but it’s rarely truly *bad.*"
Jenna,Nutrition-Conscious Parent,Q3_04,comparative_evaluative,3,Chick-fil-A,Chick-fil-A,positive,primary,"consistency, quality, service, speed, taste, family-friendly, health","For my family, Chick-fil-A stands out as being pretty reliable—your order is almost always right, the chicken tastes fresh, and the service is friendly and quick. Plus, their grilled nuggets and fruit cups are a go-to when I’m trying to make a slightly better choice for the kids."
Jenna,Nutrition-Conscious Parent,Q3_04,comparative_evaluative,3,Culver’s,Culver's,positive,secondary,"quality, variety, taste, family-friendly","Culver’s is another one I trust—their food tastes much more like it’s actually prepared fresh, and their menu has a good mix for both kids and adults (and who doesn’t love those cheese curds, honestly?)."
Jenna,Nutrition-Conscious Parent,Q3_04,comparative_evaluative,3,Five Guys,Five Guys,positive,secondary,"consistency, taste","If you’re in the mood for burgers, I’ve also found Five Guys to be super consistent, but it’s a bit pricier and a little less “picky eater” friendly."
Jenna,Nutrition-Conscious Parent,Q3_04,comparative_evaluative,3,Wendy’s,Wendy's,positive,secondary,"quality, variety, family-friendly, health","In terms of big national chains, Wendy’s usually does a solid job—especially for salads or baked potatoes, and the kids’ meals offer some better side options than just fries."
Jenna,Nutrition-Conscious Parent,Q3_05,comparative_evaluative,1,Wendy’s,Wendy's,positive,primary,"quality, taste, health, family-friendly, variety, transparency","Wendy’s has genuinely improved the last couple of years. Their salads actually look (and taste) fresh, their chicken sandwiches don’t feel like mystery meat anymore, and I’ve even caught my kids reaching for apple bites instead of fries sometimes! I appreciate that they’re pretty clear about what’s in the food, and the ingredient list isn’t two pages long for basic menu items."
Jenna,Nutrition-Conscious Parent,Q3_05,comparative_evaluative,1,Panera,Panera Bread,positive,secondary,"family-friendly, variety, health, convenience","Panera’s not really “fast food” in the classic drive-thru sense, but grabbing a family meal there has been a lifesaver on busy nights—and I don’t feel quite as guilty afterwards. The kids’ menu has more than just fried nuggets and basic PB&J. (My nine-year-old is newly obsessed with their mac and cheese.)"
Jenna,Nutrition-Conscious Parent,Q3_05,comparative_evaluative,1,Taco Bell,Taco Bell,positive,secondary,"variety, protein, health, innovation",Runner-up for me: Taco Bell. Hear me out! They seem to have made a real effort lately to add plant-based and protein-forward options. The black bean Crunchwrap and Power Bowls make fast food night feel a *little* less like a nutrition fail.
Jenna,Nutrition-Conscious Parent,Q3_05,comparative_evaluative,2,Wendy’s,Wendy's,positive,primary,"quality, taste, health, variety, protein, family-friendly","Honestly, I think **Wendy’s** has really stepped up lately. Their ingredients seem fresher, and I appreciate that they’re using things like “never frozen beef.” We’ve noticed their salads and grilled chicken sandwiches actually taste like real food, and not just an afterthought. My kids love their chicken nugget options (I even feel a little better about those compared to some other places!), and their new menu items—like the wraps and baked potatoes—give us some healthier-feeling options when we’re on the go."
Jenna,Nutrition-Conscious Parent,Q3_05,comparative_evaluative,2,Subway,Subway,positive,secondary,"health, quality, variety","**Subway** is also trying harder with more transparency on nutrition, plus those new “Sidekicks” and their revamped breads and meats do seem improved. I’ve actually noticed my oldest doesn’t complain about Subway as much, which is saying a lot."
Jenna,Nutrition-Conscious Parent,Q3_05,comparative_evaluative,2,Chick-fil-A,Chick-fil-A,positive,secondary,"quality, variety, service, family-friendly","I have to mention **Chick-fil-A** too—their food quality’s always been above average for fast food, and they’ve kept it up. I can usually find something for everyone there (fruit cups, grilled nuggets, etc.), and the staff is always friendly—even when we roll through looking harried after sports practices."
Jenna,Nutrition-Conscious Parent,Q3_05,comparative_evaluative,3,Wendy's,Wendy's,positive,primary,"taste, quality, protein, deals, app, family-friendly","Honestly, I think *Wendy's* has noticeably stepped up their game lately. Their chicken sandwiches actually taste like real chicken (the spicy one is a hit with my teenager!), and they seem more upfront about using fresh, never frozen beef. Plus, their app has some really decent family bundle deals most of the time."
Jenna,Nutrition-Conscious Parent,Q3_05,comparative_evaluative,3,Panera,Panera Bread,positive,secondary,"quality, variety, health, family-friendly","*Panera* isn’t quite “fast food,” but their kids’ menu and general ingredient quality have gotten better, and it’s nice to have more non-fried options that my younger two will still eat."
Jenna,Nutrition-Conscious Parent,Q3_05,comparative_evaluative,3,Chipotle,Chipotle,positive,secondary,"quality, variety, health, transparency",*Chipotle* is another one where I notice they’ve made some menu tweaks and their ingredient transparency is front and center—you can actually see what’s in everything.
Jenna,Nutrition-Conscious Parent,Q3_05,comparative_evaluative,3,McDonald’s,McDonald's,neutral,mentioned,"quality, family-friendly, health","And *McDonald’s* seems to be making an effort in some areas—for instance, their new burgers taste fresher, and I appreciate that the Happy Meals come with apple slices and milk as an option."
Jenna,Nutrition-Conscious Parent,Q4_01,discovery_trend,1,Wendy's,Wendy's,positive,primary,"variety, health, family-friendly, value","I think one that's totally ""slept on"" is the Wendy's baked potato. It's such a solid side or even a main (get it with chili on top!) and it feels so much more wholesome than fries."
Jenna,Nutrition-Conscious Parent,Q4_01,discovery_trend,1,Chick-fil-A,Chick-fil-A,positive,secondary,"health, taste, family-friendly","Another one: Chick-fil-A’s grilled nuggets. They get overshadowed by the regular fried nuggets, but the grilled ones are surprisingly good, especially if you’re trying for a lighter option."
Jenna,Nutrition-Conscious Parent,Q4_01,discovery_trend,1,Taco Bell,Taco Bell,positive,secondary,"variety, health, family-friendly, customizable","Oh, and Taco Bell’s Power Bowls—they feel way fresher than you’d expect from Taco Bell, and they’re easy to customize for pickier eaters (I’ll just leave off the pico or beans for my kids)."
Jenna,Nutrition-Conscious Parent,Q4_01,discovery_trend,2,Taco Bell,Taco Bell,positive,primary,"variety, health, family-friendly, customization","Taco Bell’s Power Bowls. No one asks for them, but they’re way fresher than a lot of stuff on their menu, and you can customize with beans, chicken, or omit cheese for pickier kids or dietary things."
Jenna,Nutrition-Conscious Parent,Q4_01,discovery_trend,2,Wendy’s,Wendy's,positive,secondary,"variety, health, family-friendly","Wendy’s baked potatoes. I don’t see many people order them (my kids didn't even know they had them!), but they’re filling, not fried, and you can sometimes get toppings on the side."
Jenna,Nutrition-Conscious Parent,Q4_01,discovery_trend,2,Panera,Panera Bread,positive,secondary,"variety, family-friendly, value","If you’re by a Panera, their “You Pick Two” with soup and a half sandwich or salad can stretch pretty far, especially if you order extra baguette on the side."
Jenna,Nutrition-Conscious Parent,Q4_01,discovery_trend,3,Wendy’s,Wendy's,positive,primary,"value, health, variety, family-friendly","Wendy’s Baked Potato – Seriously, don’t overlook this! It’s an affordable side that pairs with a small chili or grilled nuggets for a slightly healthier meal. Plus my kids actually like building their own with cheese or broccoli."
Jenna,Nutrition-Conscious Parent,Q4_01,discovery_trend,3,Chick-fil-A,Chick-fil-A,positive,primary,"health, quality, protein, family-friendly","Chick-fil-A Grilled Nuggets – They’re never the thing the kids ask for first, but I find them a lot less greasy than regular nuggets, and they have a short, recognizable ingredient list. The kids dip them in honey mustard, and I feel a little better about it."
Jenna,Nutrition-Conscious Parent,Q4_01,discovery_trend,3,Taco Bell,Taco Bell,positive,primary,"variety, value, customizable, family-friendly","Taco Bell Power Bowl – Not the first thing you think of at Taco Bell, right? But super customizable—rice, beans, choice of protein, veggies—and I can usually get all three kids to pick parts they like. (Their cheesy roll-ups are also a great budget kid-doesn’t-like-tacos side!)"
Jenna,Nutrition-Conscious Parent,Q4_01,discovery_trend,3,McDonald’s,McDonald's,positive,primary,"variety, health, family-friendly","McDonald’s Southwest or Side Salad + Crispy or Grilled Chicken – It’s not just about the burgers! I order a salad and a side of chicken and “make my own” bowl. Sometimes my oldest will eat half, too, which is a win."
Jenna,Nutrition-Conscious Parent,Q4_01,discovery_trend,3,Domino’s,Domino's,positive,primary,"variety, value, deals, family-friendly","Domino’s Sandwiches or Pasta Bowls – If you want to mix it up from pizza, their chicken parm sandwich or chicken alfredo pasta bowl is actually really decent and filling, and usually part of their meal deals."
Jenna,Nutrition-Conscious Parent,Q4_02,discovery_trend,1,Wendy’s,Wendy's,positive,primary,"variety, health, taste, family-friendly","Wendy’s – Grilled Chicken Ranch Wrap
If you’re looking for a not-fried option, this wrap has grilled chicken, cheese, and ranch in a tortilla. It’s been getting decent reviews and feels a little fresher than the usual sandwich."
