persona_name,persona_archetype,question_id,question_category,run_number,brand,canonical,sentiment,rank,attributes,quote
Tyler,Deal-Hunting College Student,Q3_04,comparative_evaluative,1,McDonald's,McDonald's,positive,secondary,"consistency, value, app, loyalty","For big national chains, **McDonald's** is honestly solid if you stick to the basics like McDoubles, fries, or nuggets. Stuff like the shakes or their fancier burgers can be hit or miss depending on the location and hour, but you know what you’re getting."
Tyler,Deal-Hunting College Student,Q3_04,comparative_evaluative,1,Subway,Subway,negative,mentioned,consistency,Subway and Burger King are way more inconsistent IMO.
Tyler,Deal-Hunting College Student,Q3_04,comparative_evaluative,1,Burger King,Burger King,negative,mentioned,consistency,Subway and Burger King are way more inconsistent IMO.
Tyler,Deal-Hunting College Student,Q3_04,comparative_evaluative,1,Taco Bell,Taco Bell,neutral,mentioned,"value, consistency","Taco Bell is all over the place—sometimes fire, sometimes lukewarm sadness—but at least it’s always cheap."
Tyler,Deal-Hunting College Student,Q3_04,comparative_evaluative,2,Chick-fil-A,Chick-fil-A,positive,primary,"consistency, quality, service, speed, taste, convenience, deals, app","Chick-fil-A is probably the most reliable fast food chain out there. I barely ever have a bad experience with them—the food is always hot, the chicken is always juicy, and their service is crazy consistent, even when they’re slammed. Plus, they’re fast about it, and the orders almost never get messed up. If I’m spending my money and want zero surprises, that’s usually my move."
Tyler,Deal-Hunting College Student,Q3_04,comparative_evaluative,2,Culver’s,Culver's,positive,secondary,"quality, taste","Culver’s if you’re in the Midwest (burgers always fresh, fries are fire)."
Tyler,Deal-Hunting College Student,Q3_04,comparative_evaluative,2,Raising Cane’s,Raising Cane's,positive,secondary,consistency,Raising Cane’s if you’re into chicken fingers (super consistent).
Tyler,Deal-Hunting College Student,Q3_04,comparative_evaluative,2,Panera,Panera Bread,positive,secondary,"consistency, variety",Panera for sandwiches/soups (pricy sometimes but you know what you’re getting).
Tyler,Deal-Hunting College Student,Q3_04,comparative_evaluative,2,Five Guys,Five Guys,positive,secondary,"quality, deals","Five Guys too, but that’s outside my *usual* budget if I’m not using some kind of deal."
Tyler,Deal-Hunting College Student,Q3_04,comparative_evaluative,2,McDonald’s,McDonald's,neutral,mentioned,,"McDonald’s, Taco Bell, Wendy’s, etc.—they’re all hit or miss depending on the location, time, and who’s working."
Tyler,Deal-Hunting College Student,Q3_04,comparative_evaluative,2,Taco Bell,Taco Bell,neutral,mentioned,,"McDonald’s, Taco Bell, Wendy’s, etc.—they’re all hit or miss depending on the location, time, and who’s working."
Tyler,Deal-Hunting College Student,Q3_04,comparative_evaluative,2,Wendy’s,Wendy's,neutral,mentioned,,"McDonald’s, Taco Bell, Wendy’s, etc.—they’re all hit or miss depending on the location, time, and who’s working."
Tyler,Deal-Hunting College Student,Q3_04,comparative_evaluative,3,Chick-fil-A,Chick-fil-A,positive,primary,"consistency, quality, service, taste, app, deals","But for me, Chick-fil-A is probably the most reliable. Their food usually tastes fresh, service is on point, and even when I roll through late at night, my order’s right and the chicken’s not dry or sketchy. Plus, their app deals (free sandwiches, reward points, sometimes fries) are clutch."
Tyler,Deal-Hunting College Student,Q3_04,comparative_evaluative,3,Raising Cane’s,Raising Cane's,positive,secondary,"consistency, variety","Raising Cane’s if you have one nearby. Their menu is super simple, so it’s hard for them to mess up. You know exactly what you’re getting."
Tyler,Deal-Hunting College Student,Q3_04,comparative_evaluative,3,Culver’s,Culver's,positive,mentioned,quality,Culver’s (if you’re Midwest/East coast) – burgers and custard are almost always good quality.
Tyler,Deal-Hunting College Student,Q3_04,comparative_evaluative,3,McDonald’s,McDonald's,neutral,mentioned,"consistency, app, deals","McDonald’s is a classic, but honestly, it depends a lot on the location and who’s working that night."
Tyler,Deal-Hunting College Student,Q3_04,comparative_evaluative,3,In-N-Out,In-N-Out Burger,positive,mentioned,"consistency, variety",In-N-Out (West Coast) – super consistent but the menu is limited.
Tyler,Deal-Hunting College Student,Q3_04,comparative_evaluative,3,Taco Bell,Taco Bell,neutral,mentioned,"app, deals","Late-night, I usually swing for Taco Bell or McDonald’s—then just pray for decent quality and use the app rewards to soften the blow if it’s mediocre."
Tyler,Deal-Hunting College Student,Q3_05,comparative_evaluative,1,Wendy’s,Wendy's,positive,primary,"taste, innovation, value, app, deals","Honestly, **Wendy’s** has seriously stepped up their game lately. Their burgers taste fresher than they used to, and they’ve been introducing some solid new options (like those ghost pepper items and that breakfast croissant lineup). The $5 Biggie Bag is clutch when you’re on a budget, and their app always has something decent in the offers tab."
Tyler,Deal-Hunting College Student,Q3_05,comparative_evaluative,1,McDonald’s,McDonald's,neutral,mentioned,,"It’s not like McDonald’s has gotten worse, but Wendy’s definitely leveled up."
Tyler,Deal-Hunting College Student,Q3_05,comparative_evaluative,2,Wendy’s,Wendy's,positive,primary,"quality, taste, innovation, deals, app, value","Honestly? **Wendy’s** has been stepping it up lately. Their spicy chicken sandwich has always slapped, but their burgers actually taste fresher now (and the toasted buns aren’t a lie anymore). Plus, they keep dropping new stuff like those ghost pepper fries and loaded nacho stuff, so it’s not the same boring menu.

They’ve also been killing it with app deals—like that $1 breakfast biscuit promo a while back, free fries with purchase, or buy-one-get-one chicken sandwiches. The quality jump paired with those rewards? Hard to beat on a budget."
Tyler,Deal-Hunting College Student,Q3_05,comparative_evaluative,2,Arby’s,Arby's,positive,secondary,"innovation, quality","Honorable mention: **Arby’s** legit tries more weird LTOs (even their chicken nuggets got better), but Wendy's is the one I hit up when I want good value and something new."
Tyler,Deal-Hunting College Student,Q3_05,comparative_evaluative,3,Wendy’s,Wendy's,positive,primary,"taste, quality, deals, app, value","Wendy’s has really stepped it up. Their burgers taste fresher than they did a couple of years ago, the fries are better (the “Hot & Crispy” style actually holds up), and their deals on the app are fire—like $1 biscuits for breakfast, or those 4 for $4 and Biggie Bag meal combos that just destroy everyone else for value."
Tyler,Deal-Hunting College Student,Q3_05,comparative_evaluative,3,Taco Bell,Taco Bell,positive,secondary,"variety, innovation, deals, app, loyalty","Taco Bell is also in a good place right now. They’ve brought back stuff people begged for (like nacho fries and the volcano menu), and there’s always something weird or new to try if you like variety. Their new app deals and rewards system are actually worth it too—I’ve gotten free tacos, burritos, and exclusive menu items just for checking in or ordering ahead."
Tyler,Deal-Hunting College Student,Q3_05,comparative_evaluative,3,McDonald’s,McDonald's,neutral,mentioned,"deals, app","McDonald’s is… McDonald’s, but their app is almost a cheat code for free and discounted stuff, so if you factor that in, they’re almost always worth considering."
Tyler,Deal-Hunting College Student,Q4_01,discovery_trend,1,Taco Bell,Taco Bell,positive,primary,"value, app, loyalty, variety, taste, convenience",One order I think is super slept-on is Taco Bell's **Cheesy Gordita Crunch**—especially if you use the app.
Tyler,Deal-Hunting College Student,Q4_01,discovery_trend,1,McDonald’s,McDonald's,positive,secondary,"value, taste, variety","Bonus that slaps: **McDonald’s McChicken + Hot ‘n Spicy McChicken**. Order both from the value menu (they’re like $2 each), stack them together, and you’ve got a “McGangBang” (it’s a real secret menu thing)."
Tyler,Deal-Hunting College Student,Q4_01,discovery_trend,2,Jack in the Box,Jack in the Box,positive,primary,"value, app, deals, taste, convenience",One that I feel like people don’t talk about enough is the Jack in the Box “Loaded Tiny Tacos”—especially when you use the app because they almost always have a coupon to get them for like $3–$4.
Tyler,Deal-Hunting College Student,Q4_01,discovery_trend,2,McDonald’s,McDonald's,positive,secondary,"deals, app, variety, value","Another sleeper is the McDonald’s McChicken but “Spicy” version (not always on the menu, but a lot of locations will make it if you ask for spicy sauce or add buffalo sauce). Also, their app has that $1 large fries deal like every other week."
Tyler,Deal-Hunting College Student,Q4_01,discovery_trend,2,Taco Bell,Taco Bell,positive,secondary,"value, variety, taste, convenience","Also, Taco Bell’s “Cheesy Bean & Rice Burrito”—it’s way more filling than the price ($1.49 or sometimes $1 on the value menu), and if you jazz it up with some of their free sauces (chipotle, fire, creamy jalapeño), it’s actually a solid late-night move."
Tyler,Deal-Hunting College Student,Q4_01,discovery_trend,2,Wendy’s,Wendy's,positive,secondary,"value, variety, taste, deals","And, if you want to hack stuff, try Wendy’s “Biggie Bag” with a side of ghost pepper ranch—it’s like $5, gets you a burger, nuggets, fries, and a drink."
Tyler,Deal-Hunting College Student,Q4_01,discovery_trend,3,Jack in the Box,Jack in the Box,positive,primary,"value, taste, convenience","the Jack in the Box Breakfast Jack is way underrated. It’s super cheap (usually like $2–$3), has egg, ham, and cheese on a warm bun, and you can snag it all day, not just breakfast hours."
Tyler,Deal-Hunting College Student,Q4_01,discovery_trend,3,Wendy’s,Wendy's,positive,secondary,"value, taste, convenience","Another slept on order: the Wendy’s 4 for $4 (or Biggie Bag, depending on location). You get a junior bacon cheeseburger (which honestly slaps), nuggets, fries, and a drink for around $5. It’s stupid good value, especially late at night when you’re broke and starving."
Tyler,Deal-Hunting College Student,Q4_01,discovery_trend,3,Taco Bell,Taco Bell,positive,secondary,"value, taste, app","pro-tip—Taco Bell’s Cheesy Bean and Rice Burrito. It’s like $1.50, filling as heck, and you can customize it with app-exclusive stuff (or sauces) for little to nothing."
Tyler,Deal-Hunting College Student,Q4_01,discovery_trend,3,McDonald’s,McDonald's,positive,secondary,"value, taste","If you want something less obvious, McDonald’s McDouble, add Big Mac sauce (sometimes they charge like 30 cents, sometimes free). It tastes almost like a Big Mac but way cheaper. I order it all the time."
Tyler,Deal-Hunting College Student,Q4_02,discovery_trend,1,Wendy’s,Wendy's,positive,primary,"variety, deals, app, taste","Wendy’s just dropped a few new sauce flavors for their nuggets—Honey BBQ, Garlic Parm, and Buffalo. They’re doing mix & match deals in the app, so you can try a few for cheap. Worth it if you like their nuggets and want something new."
Tyler,Deal-Hunting College Student,Q4_02,discovery_trend,1,Taco Bell,Taco Bell,positive,primary,"variety, deals, app, value, convenience","They rotate new loaded toppings—sometimes steak, sometimes vegan “beef.” They’re almost always on some $3 Box or BOGO deal if you have the app. Solid snack, especially late-night."
Tyler,Deal-Hunting College Student,Q4_02,discovery_trend,1,McDonald’s,McDonald's,positive,primary,"innovation, deals, app, taste","This just dropped—basically vanilla soft serve with butterscotch caramel chunks and candy. I’d never pay full price for McFlurries, but there’s usually a $1 off dessert in the app. If you have a sweet tooth, it’s solid."
Tyler,Deal-Hunting College Student,Q4_02,discovery_trend,1,Popeyes,Popeyes,positive,primary,"quality, taste, deals, app","Their chicken is always good, but the new BBQ sauce is genuinely fire and you can score a free regular side if you order through the Popeyes app (sometimes with a $5 minimum)."
Tyler,Deal-Hunting College Student,Q4_02,discovery_trend,1,Burger King,Burger King,positive,primary,"deals, app, taste, value","They’re spicy, pretty decent, and usually paired with cheap combo deals through the app. Good for $5–6 meals, but not super filling solo."
Tyler,Deal-Hunting College Student,Q4_02,discovery_trend,1,Sonic,Sonic,positive,primary,"deals, app, value, taste",Crinkle fries with groovy sauce—Sonic has a $1.99 deal in their app and half-price drinks at certain times. Easy snack if you want something cheap and salty.
Tyler,Deal-Hunting College Student,Q4_02,discovery_trend,2,Taco Bell,Taco Bell,positive,primary,"deals, app, variety, taste, value","Latest Taco Bell or Wendy’s nuggs are probably the best value/most unique flavor right now, especially if you stack the app deals or combos."
Tyler,Deal-Hunting College Student,Q4_02,discovery_trend,2,McDonald’s,McDonald's,positive,secondary,"deals, app, variety, value",App is running BOGO free or $1 sandwiches every other week; check those daily deals.
Tyler,Deal-Hunting College Student,Q4_02,discovery_trend,2,Wendy’s,Wendy's,positive,primary,"deals, app, variety, taste, value","Latest Taco Bell or Wendy’s nuggs are probably the best value/most unique flavor right now, especially if you stack the app deals or combos."
Tyler,Deal-Hunting College Student,Q4_02,discovery_trend,2,Jack in the Box,Jack in the Box,positive,secondary,"deals, app, variety, value","They’re pushing some *Churro Shake* right now, app will probably have a $3 shake and fries deal."
Tyler,Deal-Hunting College Student,Q4_02,discovery_trend,2,Burger King,Burger King,positive,secondary,"deals, value, variety","BK has the $5 *Your Way Meal* back some places, solid value."
Tyler,Deal-Hunting College Student,Q4_02,discovery_trend,2,Subway,Subway,positive,secondary,"value, variety","There’s a new Sidekicks menu—mini footlong churros and cookies—for $2–$3, good snack if you just want something sweet."
Tyler,Deal-Hunting College Student,Q4_02,discovery_trend,2,Del Taco,Del Taco,positive,mentioned,"deals, app, value","try hitting up Del Taco, Sonic, or Checkers/Rally’s. Sometimes it’s a free taco or fries with any drink."
Tyler,Deal-Hunting College Student,Q4_02,discovery_trend,2,Sonic,Sonic,positive,mentioned,"deals, app, value","try hitting up Del Taco, Sonic, or Checkers/Rally’s. Sometimes it’s a free taco or fries with any drink."
Tyler,Deal-Hunting College Student,Q4_02,discovery_trend,2,Checkers/Rally’s,Checkers/Rally's,positive,mentioned,"deals, app, value","try hitting up Del Taco, Sonic, or Checkers/Rally’s. Sometimes it’s a free taco or fries with any drink."
Tyler,Deal-Hunting College Student,Q4_02,discovery_trend,3,Taco Bell,Taco Bell,positive,primary,"value, variety, taste, deals, app, loyalty","Grilled Cheese Burrito is back. It’s cheesy, filling, and you can usually get it as part of a box for around $6 (which includes a drink and two sides)."
Tyler,Deal-Hunting College Student,Q4_02,discovery_trend,3,Wendy’s,Wendy's,positive,primary,"innovation, taste, deals, app, loyalty","Orange Dreamsicle Frosty just dropped—people say it’s fire if you like creamsicle flavor. (Check the app, sometimes you can get a free small Frosty with any purchase.)"
Tyler,Deal-Hunting College Student,Q4_02,discovery_trend,3,McDonald’s,McDonald's,positive,primary,"innovation, taste, deals, app, loyalty","They’re doing a Grandma McFlurry—it’s basically butterscotch and crunchy bits. Actually tasty if you can find it, and you can usually get $1 off dessert on the app."
Tyler,Deal-Hunting College Student,Q4_02,discovery_trend,3,Burger King,Burger King,positive,primary,"value, taste, deals, app","They’re doing $5 “Your Way” meals that have decent value—usually a burger, nuggets, fries, drink."
Tyler,Deal-Hunting College Student,Q4_02,discovery_trend,3,Chick-fil-A,Chick-fil-A,positive,primary,"innovation, taste, loyalty, app","Maple Pepper Bacon Sandwich is limited time. It’s better than their usual LTOs if you like sweet and smoky. Not the cheapest, but check for app scans to get points if you go."
Tyler,Deal-Hunting College Student,Q4_02,discovery_trend,3,KFC,KFC,positive,primary,"innovation, taste, deals, value",Saucy Nuggets are new—people like the Honey BBQ and Buffalo. They’ve been doing $5 box deals that include them.
Tyler,Deal-Hunting College Student,Q4_02,discovery_trend,3,Jack in the Box,Jack in the Box,positive,primary,"innovation, taste, value, variety","Smashed Jack burger line is new and heavily promoted. Lots of flavor, especially their garlic one. Also, late night munchie meals still have the best bang for the buck after 9pm."
Tyler,Deal-Hunting College Student,Q4_03,discovery_trend,1,In-N-Out Burger,In-N-Out Burger,positive,primary,"value, taste, deals, app","People go crazy for this place. The menu is mad simple, but you gotta know the secret menu (Animal Style all day). The Double-Double is classic, and you can still get a full meal for like $8 if you skip the shakes."
Tyler,Deal-Hunting College Student,Q4_03,discovery_trend,1,Whataburger,Whataburger,positive,primary,"value, deals, app, variety","Honestly, solid late-night option. Burgers are big (def share fries if you want to keep to your budget). They run limited-time stuff—right now they have a Southern Bacon Double that's bomb, and there are always random BOGO coupons on their app."
Tyler,Deal-Hunting College Student,Q4_03,discovery_trend,1,Culver’s,Culver's,positive,primary,"taste, deals, app, variety","If you’re ever in Wisconsin, or really anywhere in the Midwest, their ButterBurger and cheese curds are fire. Plus, their apps offer random “free scoop” deals if you sign up and birthday freebies."
Tyler,Deal-Hunting College Student,Q4_03,discovery_trend,1,Cook Out,Cook Out,positive,primary,"value, variety, taste","One of the GOATs for students. Insanely cheap “tray” meals (like $6) with so many options (burgers, quesadillas, chicken, etc.), plus 40+ milkshake flavors. Won’t find an app, but the value is insane."
Tyler,Deal-Hunting College Student,Q4_03,discovery_trend,1,Raising Cane’s,Raising Cane's,positive,primary,"taste, quality","Chicken fingers only, core menu. But the Cane’s Sauce is what people go for. Combo isn’t always as cheap as other places, but you can get Texas toast for like 99 cents as a side hack."
Tyler,Deal-Hunting College Student,Q4_03,discovery_trend,2,In-N-Out Burger,In-N-Out Burger,positive,primary,"value, taste, variety, deals","Lots of hype, but honestly it’s worth it for the price. Their “secret menu” (Animal Style everything) is legendary, and you can get a double cheeseburger, fries, and a drink for like $8."
Tyler,Deal-Hunting College Student,Q4_03,discovery_trend,2,Culver’s,Culver's,positive,primary,"taste, variety, deals, app","Their ButterBurgers are different than any other chain, and people go crazy for their cheese curds and frozen custard. Culver’s app sometimes drops pretty solid deals too."
Tyler,Deal-Hunting College Student,Q4_03,discovery_trend,2,Whataburger,Whataburger,positive,primary,"variety, value, convenience, deals, app","Menu is giant, burgers are huge, and they have 24-hour locations = major late-night points. Their app also drops deals like free fries or BOGO sandwiches if you sign up."
Tyler,Deal-Hunting College Student,Q4_03,discovery_trend,2,Bojangles,Bojangles,positive,primary,"taste, value, variety","If you’re into fried chicken and biscuits, this is the move. The Cajun seasoning on their fries hits different, and their breakfast is bomb/cheap."
Tyler,Deal-Hunting College Student,Q4_03,discovery_trend,2,Cook Out,Cook Out,positive,primary,"value, variety, taste, convenience","This place is insane value: $6 or $7 gets you a main, two sides (which can be nuggets, corn dog, quesadilla, etc.), and a drink. Milkshakes = legendary, and open super late."
Tyler,Deal-Hunting College Student,Q4_03,discovery_trend,2,Raising Cane’s,Raising Cane's,positive,secondary,"taste, variety",Raising Cane’s (everywhere now but started in Louisiana) for chicken fingers and secret Texas toast hacks.
Tyler,Deal-Hunting College Student,Q4_03,discovery_trend,2,Sheetz,Sheetz,positive,secondary,"variety, taste, convenience",Sheetz or Wawa (Mid-Atlantic) if you like gas station subs/snacks but way better.
Tyler,Deal-Hunting College Student,Q4_03,discovery_trend,2,Wawa,Wawa,positive,secondary,"variety, taste, convenience",Sheetz or Wawa (Mid-Atlantic) if you like gas station subs/snacks but way better.
Tyler,Deal-Hunting College Student,Q4_03,discovery_trend,3,McDonald’s,McDonald's,neutral,mentioned,,if you’re tired of the McDonald’s/Wendy’s routine.
Tyler,Deal-Hunting College Student,Q4_03,discovery_trend,3,Wendy’s,Wendy's,neutral,mentioned,,if you’re tired of the McDonald’s/Wendy’s routine.
Tyler,Deal-Hunting College Student,Q4_03,discovery_trend,3,Whataburger,Whataburger,positive,primary,"variety, taste, convenience","If you’re anywhere near Texas, this is legit a must. Their burgers are massive, the spicy ketchup slaps, and they have a ton of customization options."
Tyler,Deal-Hunting College Student,Q4_03,discovery_trend,3,Culver’s,Culver's,positive,primary,"quality, taste, deals, app","The ButterBurgers are super juicy, and the cheese curds are just next-level snacking. Culver’s custard is way better than basic fast food desserts too. They always have deals on their app for meals and combo upgrades."
Tyler,Deal-Hunting College Student,Q4_03,discovery_trend,3,Cook Out,Cook Out,positive,primary,"value, variety, convenience","Insane bang for your buck—like, you can get a full tray (burger or chicken sandwich + two sides + a drink) for like $6. Tons of options, and the shake menu is wild. It’s also open late, which is clutch after midnight."
Tyler,Deal-Hunting College Student,Q4_03,discovery_trend,3,In-N-Out,In-N-Out Burger,positive,primary,"value, taste, variety",Super solid prices (not much more than McDonald’s) and that secret menu is worth the order.
Tyler,Deal-Hunting College Student,Q4_03,discovery_trend,3,Raising Cane’s,Raising Cane's,positive,primary,"quality, value, app","Limited menu, but the chicken is legit fresh and the Cane’s sauce is *chef’s kiss*. Combo boxes are decent value, especially with app rewards."
Tyler,Deal-Hunting College Student,Q4_03,discovery_trend,3,Zippy’s,Zippy's,positive,secondary,variety,"If you’re ever in Hawaii, Zippy’s is weird and awesome."
Tyler,Deal-Hunting College Student,Q4_03,discovery_trend,3,Del Taco,Del Taco,positive,secondary,"value, app",And Del Taco sometimes runs better app value than Taco Bell for late-night runs.
Tyler,Deal-Hunting College Student,Q4_03,discovery_trend,3,Taco Bell,Taco Bell,neutral,mentioned,,And Del Taco sometimes runs better app value than Taco Bell for late-night runs.
Tyler,Deal-Hunting College Student,Q4_04,discovery_trend,1,McDonald’s,McDonald's,positive,primary,"value, deals, app, loyalty, variety, taste, convenience","Download every chain’s app (McDonald’s, Burger King, Taco Bell, Wendy’s, etc.) and enable notifications. Combine app-exclusive deals with rewards points for super cheap eats."
Tyler,Deal-Hunting College Student,Q4_04,discovery_trend,1,Burger King,Burger King,positive,secondary,"value, deals, app, loyalty","Download every chain’s app (McDonald’s, Burger King, Taco Bell, Wendy’s, etc.) and enable notifications."
Tyler,Deal-Hunting College Student,Q4_04,discovery_trend,1,Taco Bell,Taco Bell,positive,primary,"value, deals, app, loyalty, variety, taste, convenience","At Taco Bell, mix $1 menu items to make a filling meal: two Spicy Potato Soft Tacos + a side of cheesy beans = under $5 and pretty filling."
Tyler,Deal-Hunting College Student,Q4_04,discovery_trend,1,Wendy’s,Wendy's,positive,primary,"value, deals, app, loyalty, variety, taste, convenience","Download every chain’s app (McDonald’s, Burger King, Taco Bell, Wendy’s, etc.) and enable notifications."
Tyler,Deal-Hunting College Student,Q4_04,discovery_trend,1,Chipotle,Chipotle,positive,primary,"value, variety, taste, convenience, health","At Chipotle, for example, extra veggies or salsas are free and beef up burritos/bowls."
Tyler,Deal-Hunting College Student,Q4_04,discovery_trend,1,Starbucks,Starbucks,positive,primary,"value, deals, app, loyalty, variety, taste, convenience",Starbucks will give you almost any syrup or milk alternative for free if you order through the app.
Tyler,Deal-Hunting College Student,Q4_04,discovery_trend,1,Sonic,Sonic,positive,secondary,"value, deals, variety, taste, convenience",Places like Sonic and Jack in the Box run half-price apps or shakes after 8pm.
Tyler,Deal-Hunting College Student,Q4_04,discovery_trend,1,Jack in the Box,Jack in the Box,positive,secondary,"value, deals, variety, taste, convenience",Places like Sonic and Jack in the Box run half-price apps or shakes after 8pm.
Tyler,Deal-Hunting College Student,Q4_04,discovery_trend,2,McDonald’s,McDonald's,positive,primary,"deals, app, loyalty, value","All the major chains (McDonald’s, Burger King, Taco Bell, Wendy’s, Popeyes, etc.) have apps with exclusive deals."
